{
  "device_id": "sensor-b-007",
  "event_type": "heartbeat",
  "firmware": "2.0.1",
  "region": "us-east",
  "sample_rate_hz": 60,
  "readings": [
    {
      "metric": "temp_c",
      "value": 24.5
    },
    {
      "metric": "humidity_pct",
      "value": 40.0
    }
  ],
  "device": {
    "serial": "SN-B-7",
    "model": "T2000"
  },
  "power": "mains"
}
